{
  "type": "object",
  "properties": {
    "event_id": {
      "type": "string",
      "minLength": 1
    },
    "event_type": {
      "const": "demo.meeting_answer.v1"
    },
    "request_id": {
      "type": "string",
      "minLength": 1
    },
    "workflow_run_id": {
      "type": "string",
      "minLength": 1
    },
    "step_run_id": {
      "type": "string",
      "minLength": 1
    },
    "attempt_id": {
      "type": "string",
      "minLength": 1
    },
    "subject_scope_ref": {
      "type": "string",
      "minLength": 1
    },
    "received_at": {
      "type": "string",
      "format": "date-time"
    },
    "payload": {
      "type": "object",
      "properties": {
        "met_driver": {
          "type": "boolean"
        }
      },
      "required": [
        "met_driver"
      ],
      "additionalProperties": false
    },
    "intent_id": {
      "type": "string",
      "minLength": 1
    }
  },
  "additionalProperties": false,
  "required": [
    "event_id",
    "event_type",
    "request_id",
    "workflow_run_id",
    "step_run_id",
    "attempt_id",
    "subject_scope_ref",
    "received_at",
    "payload",
    "intent_id"
  ],
  "$schema": "https://json-schema.org/draft/2020-12/schema"
}
